{
  "schemaVersion": "omniseller.policy-contract.v1",
  "policyContractId": "etsy-us-general-2026-09-08-v1",
  "marketplace": "ETSY",
  "site": "US",
  "locales": ["en-US", "es-US"],
  "effectiveFrom": "2026-09-08T00:00:00Z",
  "checkedAt": "2026-09-08T00:00:00Z",
  "verificationStatus": "PUBLIC_BASELINE",
  "approvalCritical": true,
  "supersedes": null,
  "cohort": {
    "mediaClass": "ALL",
    "productTypeIds": [],
    "categoryIds": [],
    "sellerAccountIds": []
  },
  "sourceRefs": [
    {
      "kind": "PUBLIC_URL",
      "url": "https://www.etsy.com/seller-handbook/article/382774281517",
      "capturedAt": "2026-09-08T00:00:00Z"
    },
    {
      "kind": "PUBLIC_URL",
      "url": "https://www.etsy.com/seller-handbook/article/1399426136697",
      "capturedAt": "2026-09-08T00:00:00Z"
    }
  ],
  "rules": {
    "title": { "maxChars": 140, "counting": "UNICODE_CODE_POINTS" },
    "tags": { "maxCount": 13, "targetCount": 13, "maxChars": 20 }
  }
}
